venue_id,pricing_model,label,price,currency,tier_audience,days,time_start,time_end,duration_minutes,group_size_min,group_size_max,venue_confidence,notes,source_quote,data_quality_notes
ph-the-pickleball-club-ayala-malls-manila-bay-pasay,session_per_player,Saturday Evening Open Play,300,PHP,walk_in,sat,18:00,22:00,240,,,medium,"4 hours, 3 courts, Indoor Sports Center. Duration from Facebook post (Aug 2 session); price assumed same as Friday sessions at ₱300/head — not separately quoted for Saturday.","Sat, Aug 2 6:00 PM
Ayala Malls Manila Bay, Parañaque
4hours | 3 courts - Indoor Sports Center","Pricing (₱300/head) is clearly stated for the Friday Reclub session; Saturday and Wednesday rates are assumed to be the same as no separate figures are given. These are community-organized open play sessions by Palo Pilipinas, not a venue-published price schedule — general venue operating hours and any direct court rental rates are not available from the sources."
ph-the-pickleground-ph-cavite,session_per_player,Morning · Member,150,PHP,member,,07:00,12:00,,,,medium,,Morning (7AM–12NN) PHP 150 – Member,"Hours from FB intro ""OPEN DAILY 7AM-12MN"". Pricing taken from legacy notes (per-player open play tiers); Facebook page itself is behind login wall so rates could not be verified directly from source page."
ph-the-pickleground-ph-cavite,session_per_player,Morning · Non-Member,180,PHP,non_member,,07:00,12:00,,,,medium,,PHP 180 – Non-Member,"Hours from FB intro ""OPEN DAILY 7AM-12MN"". Pricing taken from legacy notes (per-player open play tiers); Facebook page itself is behind login wall so rates could not be verified directly from source page."
ph-the-pickleground-ph-cavite,session_per_player,Afternoon · Member,170,PHP,member,,12:00,18:00,,,,medium,,Afternoon (12NN–6PM) PHP 170 – Member,"Hours from FB intro ""OPEN DAILY 7AM-12MN"". Pricing taken from legacy notes (per-player open play tiers); Facebook page itself is behind login wall so rates could not be verified directly from source page."
ph-the-pickleground-ph-cavite,session_per_player,Afternoon · Non-Member,200,PHP,non_member,,12:00,18:00,,,,medium,,PHP 200 – Non-Member,"Hours from FB intro ""OPEN DAILY 7AM-12MN"". Pricing taken from legacy notes (per-player open play tiers); Facebook page itself is behind login wall so rates could not be verified directly from source page."
ph-the-pickleground-ph-cavite,session_per_player,Evening · Member,200,PHP,member,,18:00,24:00,,,,medium,,Evening (6PM–12MN) PHP 200 – Member,"Hours from FB intro ""OPEN DAILY 7AM-12MN"". Pricing taken from legacy notes (per-player open play tiers); Facebook page itself is behind login wall so rates could not be verified directly from source page."
ph-the-pickleground-ph-cavite,session_per_player,Evening · Non-Member,250,PHP,non_member,,18:00,24:00,,,,medium,,PHP 250 – Non-Member,"Hours from FB intro ""OPEN DAILY 7AM-12MN"". Pricing taken from legacy notes (per-player open play tiers); Facebook page itself is behind login wall so rates could not be verified directly from source page."
ph-the-smash-city-valenzuela-s-premier-pickleball-centre-valenzuela,court_hour,Private Court Booking – Off Peak (Weekday),350,PHP,,mon|tue|wed|thu|fri,08:00,17:00,60,,,high,Exclusive use of court for group. Rate applies to weekday bookings 8AM–5PM.,Private Court Booking - OFF Peak ... Rate applies to bookings from 8am to 5pm on weekdays. Php 350.00 / 60mins,"All four pricing tiers sourced verbatim from the official website (thesmashcity.com/services/). Operating hours are inferred from pricing window boundaries (earliest booking 8AM, peak end 11PM) — no explicit daily schedule table was published. Weekend opening/closing times are assumed to match weekday bounds; actual hours should be confirmed directly with the venue."
ph-the-smash-city-valenzuela-s-premier-pickleball-centre-valenzuela,court_hour,Private Court Booking – Peak (Weekday Evening),400,PHP,,mon|tue|wed|thu|fri,17:00,23:00,60,,,high,Exclusive use of court for group. Rate applies to bookings from 5pm to 11pm on weekdays.,Private Court Booking - Peak ... Rate applies to bookings from 5pm to 11pm or weekends. Php 400.00 / 60mins,"All four pricing tiers sourced verbatim from the official website (thesmashcity.com/services/). Operating hours are inferred from pricing window boundaries (earliest booking 8AM, peak end 11PM) — no explicit daily schedule table was published. Weekend opening/closing times are assumed to match weekday bounds; actual hours should be confirmed directly with the venue."
ph-the-smash-city-valenzuela-s-premier-pickleball-centre-valenzuela,court_hour,Private Court Booking – Peak (Weekend),400,PHP,,sat|sun,,,60,,,high,Exclusive use of court for group. Peak rate applies all day on weekends.,Private Court Booking - Peak ... Rate applies to bookings from 5pm to 11pm or weekends. Php 400.00 / 60mins,"All four pricing tiers sourced verbatim from the official website (thesmashcity.com/services/). Operating hours are inferred from pricing window boundaries (earliest booking 8AM, peak end 11PM) — no explicit daily schedule table was published. Weekend opening/closing times are assumed to match weekday bounds; actual hours should be confirmed directly with the venue."
ph-the-smash-city-valenzuela-s-premier-pickleball-centre-valenzuela,session_per_player,Open Play – Off Peak (Morning),200,PHP,walk_in,mon|tue|wed|thu|fri,08:00,12:00,,,,high,"Booked via Reclub app, scheduled one week in advance. Casual open play session.",Open Plays - OFF Peak ... Rate applies to sessions from 8am to 12nn. Php 200.00 / session,"All four pricing tiers sourced verbatim from the official website (thesmashcity.com/services/). Operating hours are inferred from pricing window boundaries (earliest booking 8AM, peak end 11PM) — no explicit daily schedule table was published. Weekend opening/closing times are assumed to match weekday bounds; actual hours should be confirmed directly with the venue."
ph-the-smash-city-valenzuela-s-premier-pickleball-centre-valenzuela,session_per_player,Open Play – Peak (Weekend),250,PHP,walk_in,sat|sun,,,,,,high,"Booked via Reclub app, scheduled one week in advance. Peak rate applies all day on weekends.",Open Plays - Peak ... Rate applies to sessions during weekends. Php 250.00 / session,"All four pricing tiers sourced verbatim from the official website (thesmashcity.com/services/). Operating hours are inferred from pricing window boundaries (earliest booking 8AM, peak end 11PM) — no explicit daily schedule table was published. Weekend opening/closing times are assumed to match weekday bounds; actual hours should be confirmed directly with the venue."
ph-vensand-pickleball-hub-rodriguez,session_per_player,Open Play · AC (per head),250,PHP,walk_in,,,,,,,medium,Air-conditioned open play; rate sourced from legacy normaliser notes only — no verbatim quote recoverable from scraped pages,₱250/head AC OP,"The ₱250/head open play rate and ₱20 ball rental appear only in legacy normaliser notes and could not be verified from any scraped source page; they are included but flagged accordingly. The ₱1,000 beginner training fee and ₱50 paddle rental are directly confirmed via the Reclub RRPC drills event listing. Operating hours were not recoverable from any source (Facebook only showed ""Closed now"" with no schedule); the Thursday 8–10AM training slot mentioned in legacy notes has no confirming source quote. Reclub displays the price as ""$1,000.00"" but all descriptive text unambiguously states PHP."
ph-vensand-pickleball-hub-rodriguez,session_per_player,Beginner Training (RRPC Drills),1000,PHP,walk_in,mon,18:00,20:00,120,,,medium,"Structured drills/lessons hosted by Rodriguez Rizal Pickleball Club (RRPC). Legacy notes also mention a Thu 8–10AM slot but not confirmed in scraped sources. Reclub UI displays $1,000.00 but all in-listing text confirms P1000 (PHP).",Begginers Training Fee: P1000,"The ₱250/head open play rate and ₱20 ball rental appear only in legacy normaliser notes and could not be verified from any scraped source page; they are included but flagged accordingly. The ₱1,000 beginner training fee and ₱50 paddle rental are directly confirmed via the Reclub RRPC drills event listing. Operating hours were not recoverable from any source (Facebook only showed ""Closed now"" with no schedule); the Thursday 8–10AM training slot mentioned in legacy notes has no confirming source quote. Reclub displays the price as ""$1,000.00"" but all descriptive text unambiguously states PHP."
ph-vensand-pickleball-hub-rodriguez,entry_fee,Paddle Rental,50,PHP,,,,,,,,medium,Add-on rental fee on top of session fee,Paddle Rental Fee: P50,"The ₱250/head open play rate and ₱20 ball rental appear only in legacy normaliser notes and could not be verified from any scraped source page; they are included but flagged accordingly. The ₱1,000 beginner training fee and ₱50 paddle rental are directly confirmed via the Reclub RRPC drills event listing. Operating hours were not recoverable from any source (Facebook only showed ""Closed now"" with no schedule); the Thursday 8–10AM training slot mentioned in legacy notes has no confirming source quote. Reclub displays the price as ""$1,000.00"" but all descriptive text unambiguously states PHP."
ph-vensand-pickleball-hub-rodriguez,entry_fee,Ball Rental,20,PHP,,,,,,,,medium,From legacy normaliser notes only; no verbatim quote recoverable from scraped pages,ball rental ₱20,"The ₱250/head open play rate and ₱20 ball rental appear only in legacy normaliser notes and could not be verified from any scraped source page; they are included but flagged accordingly. The ₱1,000 beginner training fee and ₱50 paddle rental are directly confirmed via the Reclub RRPC drills event listing. Operating hours were not recoverable from any source (Facebook only showed ""Closed now"" with no schedule); the Thursday 8–10AM training slot mentioned in legacy notes has no confirming source quote. Reclub displays the price as ""$1,000.00"" but all descriptive text unambiguously states PHP."
ph-violago-compound-pickleball-meycauayan,session_per_player,Daily Session · Per Player,100,PHP,walk_in,,17:00,21:00,,,,high,PDF lists as Indoor Court; venue metadata flags as outdoor — discrepancy noted.,"Violago Compound Calmalig Meycauayan NCR 1 Indoor Court Daily, 5p-9p p100/player","Price (₱100/player) and schedule (Daily 5p–9p) sourced directly from the Philippine Pickleball Federation PDF (Sept 1, 2025). Minor discrepancy: PDF lists the court as ""Indoor"" while venue metadata flags it as outdoor; Pickleheads source was blocked by Cloudflare so could not be verified."
ph-vital-mpact-gym-pickleball-cubao-quezon-city,session_per_player,Thursday Open Play · Walk-in,250,PHP,walk_in,thu,18:00,21:00,180,,,medium,1 indoor Taraflex court; beginner-friendly; paddle rental available for ₱100 extra; 1 extra paddle free to use; free parking; shower available; pay before play via GCash,Per Player $250.00 … ✔️6PM-9PM (3 hrs) ✔️1 Indoor court (Taraflex),"Only one Reclub event listing (Thursday evening open play at ₱250/player) was recoverable; no website or full Facebook post pricing was accessible. Operating hours for other days are unknown — only the Thursday 6–9 PM session is confirmed. Reclub displays the amount as ""$250.00"" but context (PHP venue, P100 paddle rental reference) confirms this is PHP 250."