venue_id,pricing_model,label,price,currency,tier_audience,days,time_start,time_end,duration_minutes,group_size_min,group_size_max,venue_confidence,notes,source_quote,data_quality_notes
ph-abra-high-school-gym-bangued,session_per_player,Open Play · Walk-in,50,PHP,walk_in,mon|wed|fri,17:00,19:30,,,,high,2 Indoor Courts,"Abra High School Gym Natividad St. Bangued Abra Bangued 2 Indoor Courts MWF, 5p-7:30p p50/player June Vinuan","All data sourced from the Philippine Pickleball Federation PDF (Sept 1, 2025). Pickleheads.com was blocked. Schedule is MWF 5p–7:30p at ₱50/player; no other tiers mentioned. Tuesday/Thursday/Saturday/Sunday hours are not listed."
ph-activate-sports-ph-one-ayala-makati,court_hour,Standard Rate,1100,PHP,,,10:00,21:00,60,,,medium,Listed on Venyu.ph as 'Regular Hours' rate; venue is marked Unverified on Venyu,Standard Rate ₱1100/hour · Regular Hours · 10:00 AM – 9:00 PM,"Single rate of ₱1100/hour sourced from Venyu.ph, which marks this listing as ""Unverified""; no peak/off-peak or member/non-member tiers are shown. Operating hours (10 AM–9 PM) are stated on Venyu but no day-of-week breakdown is given, so the same hours are assumed daily. Facebook and Instagram sources yielded no additional pricing detail."
ph-albay-pickleball-club-emmalene-iimuro-tennis-club-legazpi-city,session_per_player,Open Play · Per Player (Saturday session),100,PHP,walk_in,sat,15:00,16:00,60,,,low,Single historical meet on Reclub (Mar 14); this meet has ended. Currency shown as '$100.00' on Reclub but assumed PHP given Philippine venue context.,Per Player $100.00,Pricing is derived from a single ended Reclub meet listing showing '$100.00 per player' — currency displayed as '$' but assumed PHP given Philippine venue; no other pricing or confirmed recurring hours are available. Facebook and group pages were login-gated with no further rate details visible. Operating hours are entirely unconfirmed beyond this one historical session slot.
ph-athlete-central-cainta,court_hour,Pickleball Court,500,PHP,,,,,60,,,high,Standard pickleball court rental,Pickleball 60 min ... ₱500.00,"Prices are clearly listed on the booking.page source with explicit amounts and 60-min durations. The legacy notes mention ₱200–₱250/player open-play sessions but no such rate appears in any verifiable source text, so it was excluded. KTV pricing (₱1,500/hr) was omitted as it is not pickleball-related."
ph-athlete-central-cainta,court_hour,Pickleball Pro Court (USAPA Hard Floor),600,PHP,,,,,60,,,high,Tournament-grade USAPA hard floor surface; exceptional ball bounce and consistent speed,Pickleball Pro Court (Hard Floor) ... ₱600.00 ... Enjoy a true tournament-grade playing surface built to official USAPA standards.,"Prices are clearly listed on the booking.page source with explicit amounts and 60-min durations. The legacy notes mention ₱200–₱250/player open-play sessions but no such rate appears in any verifiable source text, so it was excluded. KTV pricing (₱1,500/hr) was omitted as it is not pickleball-related."
ph-athlete-central-cainta,court_hour,Family Court (Pickleball or Badminton),750,PHP,,,,,60,,,high,Extra-wide court suitable for families and groups; can be used for Pickleball or Badminton,"Family Court – Best for Families & Groups 60 min ... ₱750.00 ... Enjoy extra space for the whole family or friends, perfect for Pickleball or Badminton.","Prices are clearly listed on the booking.page source with explicit amounts and 60-min durations. The legacy notes mention ₱200–₱250/player open-play sessions but no such rate appears in any verifiable source text, so it was excluded. KTV pricing (₱1,500/hr) was omitted as it is not pickleball-related."
ph-athlete-central-ph-cainta,session_per_player,Tickle my Pickle · Back of House (Beginner Open Play),200,PHP,walk_in,tue,21:00,01:00,240,,22,medium,"Night owl beginner-friendly open play, Courts #5 & 6. Max 22 pax. GCash payment first to confirm: +639282378306 (D.K.Z.S). This was a specific dated event (Mar 10); recurrence not confirmed.",Price: 200/person … Time: 9 PM to 1 AM … PAX: Max of 22 only,"The ₱200/player rate is directly confirmed via a verbatim Reclub event listing (Tickle my Pickle, Mar 10 9PM–1AM). The ₱300/player Pro Court rate (Billy Arceo, 7–11PM) comes solely from the legacy normaliser notes with no live source page available to verify; all booking URLs and the Reclub club page returned 404/not-found errors. The 24/7 hours are confirmed by both the Facebook page (""Always open"") and the venue website title (""Athlete Central Cainta 24/7"")."
ph-athlete-central-ph-cainta,session_per_player,Pro Court Open Play · Billy Arceo,300,PHP,walk_in,,19:00,23:00,240,,,medium,Rate sourced from legacy normaliser notes only — no live source page confirmed. Court label 'Pro Court'. GCash: 09771773535 (Wella De Leon).,PHP 300/player (Pro Court 7-11PM via Billy Arceo),"The ₱200/player rate is directly confirmed via a verbatim Reclub event listing (Tickle my Pickle, Mar 10 9PM–1AM). The ₱300/player Pro Court rate (Billy Arceo, 7–11PM) comes solely from the legacy normaliser notes with no live source page available to verify; all booking URLs and the Reclub club page returned 404/not-found errors. The 24/7 hours are confirmed by both the Facebook page (""Always open"") and the venue website title (""Athlete Central Cainta 24/7"")."
ph-bacnotan-pickleball-club-first-ever-pb-court-in-bacnotan,session_per_player,Open Play · Per Player,150,PHP,walk_in,,18:00,22:00,,,,high,Daily 6PM–10PM open play schedule. Honesty Court — payment via GCash 0917 188 3164.,"Open Play Schedule: • Daily, 6 PM – 10 PM • ₱150 per player","All pricing tiers are verbatim from the Reclub listing. The ""$150.00"" display on Reclub is a currency symbol rendering artifact — clearly ₱150 PHP given the peso signs used throughout the body text. Hours confirmed as 24/7 by both Facebook (""Always open"", ""Open 24/7"") and allpickleballcourts.com (00:00–00:00 all days). ""Succeeding hours ₱200/hr"" is ambiguous as to whether it applies only to open play overruns or also to court rentals — noted in the row."
ph-bacnotan-pickleball-club-first-ever-pb-court-in-bacnotan,court_hour,Court Rental · Below 4 Players,200,PHP,walk_in,,,,60,1,3,high,Court reservation rate for small groups. Payment via GCash 0917 188 3164.,Court Reservation Rates: • ₱200/hour for groups below 4 players,"All pricing tiers are verbatim from the Reclub listing. The ""$150.00"" display on Reclub is a currency symbol rendering artifact — clearly ₱150 PHP given the peso signs used throughout the body text. Hours confirmed as 24/7 by both Facebook (""Always open"", ""Open 24/7"") and allpickleballcourts.com (00:00–00:00 all days). ""Succeeding hours ₱200/hr"" is ambiguous as to whether it applies only to open play overruns or also to court rentals — noted in the row."
ph-bacnotan-pickleball-club-first-ever-pb-court-in-bacnotan,session_per_player,Court Rental · 4+ Players (Per Head),50,PHP,walk_in,,,,60,4,,high,Per-head rate when group is 4 or more players. Payment via GCash 0917 188 3164.,Court Reservation Rates: • ₱50/head for groups 4 players and above,"All pricing tiers are verbatim from the Reclub listing. The ""$150.00"" display on Reclub is a currency symbol rendering artifact — clearly ₱150 PHP given the peso signs used throughout the body text. Hours confirmed as 24/7 by both Facebook (""Always open"", ""Open 24/7"") and allpickleballcourts.com (00:00–00:00 all days). ""Succeeding hours ₱200/hr"" is ambiguous as to whether it applies only to open play overruns or also to court rentals — noted in the row."
ph-bacnotan-pickleball-club-first-ever-pb-court-in-bacnotan,court_hour,Succeeding Hours,200,PHP,walk_in,,,,60,,,high,Rate for hours beyond the open play session block.,Succeeding hours: ₱200/hour,"All pricing tiers are verbatim from the Reclub listing. The ""$150.00"" display on Reclub is a currency symbol rendering artifact — clearly ₱150 PHP given the peso signs used throughout the body text. Hours confirmed as 24/7 by both Facebook (""Always open"", ""Open 24/7"") and allpickleballcourts.com (00:00–00:00 all days). ""Succeeding hours ₱200/hr"" is ambiguous as to whether it applies only to open play overruns or also to court rentals — noted in the row."
ph-banay-banay-pickleball-lipa,session_per_player,Open Play Session (6 hrs),250,PHP,,wed|fri|sat,16:00,22:00,360,,,medium,Session is 4PM–10PM (6 hours) based on Reclub activity listings; price sourced from Facebook post.,6 HOURS OF OPEN PLAY for ONLY ₱250!,"Price of ₱250 comes from a truncated Facebook post snippet (""6 HOURS OF OPEN PLAY for ONLY ₱250! … See more"") and could not be fully verified; the full post was behind a login wall. Operating days/hours are inferred only from the three upcoming Reclub activities visible (Wed, Fri, Sat 4PM–10PM); other days may also have sessions but are not confirmed."
ph-blue-ridge-pickleball-club-quezon-city,session_per_player,Wednesday Open Play (8AM-12NN),150,PHP,,wed,08:00,12:00,240,,,high,"Recurring every Wednesday, hosted by Blue Ridge Pickleball Club at Blue Ridge B Multi-Purpose Gym",Open Play 8am to 12 noon ... Per Player $150.00,Reclub lists a recurring Wednesday 8AM-12NN open play at ₱150/player. Currency shown as $ but contextually PHP. No other days/rates published; FB group is private.
ph-bravo-pickleball-vista-mall-bataan-balanga,court_hour,Ball machine / drill machine rental,600,PHP,,,,,60,,,low,"Rate is for the drill/ball machine rental only, not court rental. Court rental rates not published.",you can rent our ball machine for only P600/hr,"No court rental or open play session rates are published on any available source; the only numeric price found is the ball machine rental at ₱600/hr from a Facebook post. Reclub and Facebook both direct inquiries to the admin (0956-713-7167 / 0917-853-7787). Hours are described only as ""mall hours"" with no specific open/close times. Legacy hint of ₱150–200 range could not be verified from any source."
ph-camp-ola-pickleball-courts-legazpi-legazpi-city,free,Free public courts,0,PHP,walk_in,,,,,,,low,Permanent lines and portable nets available; inside secured camp environment.,Free public courts per Pickleheads.,"All source URLs failed to fetch, including the Pickleheads page (blocked by Cloudflare). The only usable signal is the legacy normaliser note stating ""Free public courts per Pickleheads."" No operating hours were recoverable from any source."
ph-ccf-center-pickleball-pasig,session_per_player,Open Play · Walk-in,200,PHP,walk_in,fri,18:30,21:30,180,,,high,"6 courts total: 4 open play, 2 coaching. Contact: Kenneth Ti 0917-808-3809","CCF Center 7/F, CCF Gym, Ortigas Ave cor C5 Pasig NCR 6 4 open play, 2 coaching Fri, 630p-930p p200/player Kenneth Ti","Schedule and price come from a clear verbatim entry in the Philippine Pickleball Federation directory (Sept 1, 2025). Only Friday hours are confirmed; no other days listed. Facebook page confirms venue location but shows login wall with no additional pricing or schedule detail."
ph-corinthian-gardens-pickleball-club-quezon-city,session_per_player,Friday DUPR Night · Walk-in / Non-resident,250,PHP,walk_in,fri,18:00,22:00,240,,27,medium,4-hour DUPR rated open play session. Max 27 players. Payment via GCash or BDO to Jason Bangayan required to confirm slot. Cut-off Friday 4PM. No cancellation/refund from Thursday onwards.,Fee: P250,"Only one confirmed session (Friday DUPR Night) is available from the Reclub source; operating hours for other days are unknown. The Reclub UI displayed ""$250.00"" but the body text clearly states ""Fee: P250"" in PHP, so PHP is used. Legacy hints citing ₱170–220 from Pickleball.ph are likely outdated; the current Reclub rate of ₱250 (non-resident) / ₱180 (resident) is used as the authoritative figure. Pickleheads was blocked and provided no usable data."
ph-corinthian-gardens-pickleball-club-quezon-city,session_per_player,Friday DUPR Night · Corinthian Gardens Resident,180,PHP,homeowner,fri,18:00,22:00,240,,27,medium,Discounted rate for Corinthian Gardens residents. Same 4-hour DUPR session. Payment required to confirm slot.,Residents pay only P180,"Only one confirmed session (Friday DUPR Night) is available from the Reclub source; operating hours for other days are unknown. The Reclub UI displayed ""$250.00"" but the body text clearly states ""Fee: P250"" in PHP, so PHP is used. Legacy hints citing ₱170–220 from Pickleball.ph are likely outdated; the current Reclub rate of ₱250 (non-resident) / ₱180 (resident) is used as the authoritative figure. Pickleheads was blocked and provided no usable data."
ph-courtside-amore-daet,session_per_player,Open Play Night · Walk-in / General,250,PHP,walk_in,sat,15:00,23:00,480,,,low,Admission fee covers court play plus snacks and drinks for the night. Walk-ins accepted only when slots open up; charged the same fee regardless of arrival time. This was the inaugural open play event; regular pricing may differ.,"Per Player $250.00 … The admission fee for this session covers both your court play, and snacks and drinks for the night.","The only recoverable price (₱250/player) comes from a single inaugural event listing on Reclub, displayed as ""$250.00"" — a known Reclub PHP-display quirk; treated as PHP 250. Facebook and Instagram direct visitors to DM for rates, so no regular/recurring pricing is publicly available. Hours are inferred solely from this one event; standing schedule is unknown."
ph-dink-and-shot-marikina,session_per_player,Open Play · Per Player (Impact Open Play),200,PHP,,sat,15:00,18:00,180,,,high,Court fee per head for organised open play session; paid via Gcash. Entrance pass of ₱100 required on top.,court fee is only P200 per head which can be paid to Gcash number 09163180208,"Hours are verbatim from the venue website. Pricing is from a single Reclub Impact Open Play listing (May 3, 2025): ₱200/player court fee + ₱100 venue entrance pass. The venue's own booking site (booking.page) returned 404, so general court rental rates are not directly published; the legacy PDF ₱250/player rate could not be verified from accessible sources and is not included."
ph-dink-and-shot-marikina,entry_fee,Venue entrance pass,100,PHP,,,,,,,,high,Required per player; allows arrival 1 hour before and stay 1 hour after court reservation. Purchased via dinkandshot.com booking.,The venue also requires each player to purchase an entrance pass of P100 which allows you to arrive 1 hour before the court reservation and 1 hour after.,"Hours are verbatim from the venue website. Pricing is from a single Reclub Impact Open Play listing (May 3, 2025): ₱200/player court fee + ₱100 venue entrance pass. The venue's own booking site (booking.page) returned 404, so general court rental rates are not directly published; the legacy PDF ₱250/player rate could not be verified from accessible sources and is not included."
ph-dona-juana-subdivision-pickleball-pasig,unknown,DJS Basketball Court — open play (cost TBD),,PHP,,wed|sat,,,,,,low,Schedule: Wed & Sat 8a-12n; Sat also 7:30p-10:30p. Cost listed as 'tbd' in PPF directory. Separate PAPA-DJS session on Sat 2p-5p listed as 'Shared'.,"DJS Basketball Court Doña Juana Subd, C Reymundo Ave, Rosario Pasig NCR 3 Covered Wed, Sat, 8a-12n, Sat, 730-1030p tbd Bianca Cordova 0908-293-7155","Cost is explicitly listed as ""tbd"" in the September 2025 PPF directory; no amount is recoverable from any source. The Reclub page redirected through a Facebook external-link warning and yielded no pricing content. Hours are inferred from the PPF schedule column only."
ph-dragonsmash-taguig,court_hour,Court rental,350,PHP,,,,,60,,,medium,Indoor wood and acrylic courts; portable nets available. Booking required via website.,350 per hour,"Hours confirmed verbatim from venue website (""open daily, with court hours from 7:00 AM to 12 Midnight""). Price of ₱350/hour sourced from Pickleheads listing only — no rate breakdown (peak/off-peak, member/non-member) was available from any source. Facebook page was inaccessible."
ph-fairview-terraces-pickleball-quezon-city,session_per_player,Open Play · BYO Paddle,100,PHP,walk_in,mon|tue|wed|thu|fri|sat|sun,17:00,21:00,,,,medium,Bring your own paddle,PHP 100/head – bring your own paddle,"Pricing is read from a promotional image in the Facebook post (June 27, 2025); text is legible but image-sourced. The July free-play promo is time-limited and may no longer apply. Paddle rental (PHP 50/hour) is listed on the image but applies as an add-on, not a standalone session price, so it is captured in notes only. Hours derived by combining the two schedule windows (court rental 10AM–5PM + open play 5PM–9PM = 10AM–9PM daily); mall hours for Fri–Sun are 10AM–10PM but pickleball close is stated as 9PM."
ph-fairview-terraces-pickleball-quezon-city,session_per_player,Open Play · Paddle Provided,150,PHP,walk_in,mon|tue|wed|thu|fri|sat|sun,17:00,21:00,,,,medium,Paddle provided by venue,PHP 150/head – paddle provided,"Pricing is read from a promotional image in the Facebook post (June 27, 2025); text is legible but image-sourced. The July free-play promo is time-limited and may no longer apply. Paddle rental (PHP 50/hour) is listed on the image but applies as an add-on, not a standalone session price, so it is captured in notes only. Hours derived by combining the two schedule windows (court rental 10AM–5PM + open play 5PM–9PM = 10AM–9PM daily); mall hours for Fri–Sun are 10AM–10PM but pickleball close is stated as 9PM."
ph-fairview-terraces-pickleball-quezon-city,court_hour,Court Rental · 2 Players,250,PHP,walk_in,mon|tue|wed|thu|fri|sat|sun,10:00,17:00,60,2,2,medium,Rate is per court per hour for 2 players,2 players – PHP 250,"Pricing is read from a promotional image in the Facebook post (June 27, 2025); text is legible but image-sourced. The July free-play promo is time-limited and may no longer apply. Paddle rental (PHP 50/hour) is listed on the image but applies as an add-on, not a standalone session price, so it is captured in notes only. Hours derived by combining the two schedule windows (court rental 10AM–5PM + open play 5PM–9PM = 10AM–9PM daily); mall hours for Fri–Sun are 10AM–10PM but pickleball close is stated as 9PM."
ph-fairview-terraces-pickleball-quezon-city,court_hour,Court Rental · 3 Players,300,PHP,walk_in,mon|tue|wed|thu|fri|sat|sun,10:00,17:00,60,3,3,medium,Rate is per court per hour for 3 players,3 players – PHP 300,"Pricing is read from a promotional image in the Facebook post (June 27, 2025); text is legible but image-sourced. The July free-play promo is time-limited and may no longer apply. Paddle rental (PHP 50/hour) is listed on the image but applies as an add-on, not a standalone session price, so it is captured in notes only. Hours derived by combining the two schedule windows (court rental 10AM–5PM + open play 5PM–9PM = 10AM–9PM daily); mall hours for Fri–Sun are 10AM–10PM but pickleball close is stated as 9PM."
ph-fairview-terraces-pickleball-quezon-city,court_hour,Court Rental · 4 Players,350,PHP,walk_in,mon|tue|wed|thu|fri|sat|sun,10:00,17:00,60,4,4,medium,Rate is per court per hour for 4 players,4 players – PHP 350,"Pricing is read from a promotional image in the Facebook post (June 27, 2025); text is legible but image-sourced. The July free-play promo is time-limited and may no longer apply. Paddle rental (PHP 50/hour) is listed on the image but applies as an add-on, not a standalone session price, so it is captured in notes only. Hours derived by combining the two schedule windows (court rental 10AM–5PM + open play 5PM–9PM = 10AM–9PM daily); mall hours for Fri–Sun are 10AM–10PM but pickleball close is stated as 9PM."
ph-fairview-terraces-pickleball-quezon-city,free,Free Open Court & Court Rentals via Reclub (July promo),0,PHP,,,,,,,,medium,Promotional offer for the whole month of July only; register via Reclub,Register via Reclub for FREE open court and court rentals for the whole month of July,"Pricing is read from a promotional image in the Facebook post (June 27, 2025); text is legible but image-sourced. The July free-play promo is time-limited and may no longer apply. Paddle rental (PHP 50/hour) is listed on the image but applies as an add-on, not a standalone session price, so it is captured in notes only. Hours derived by combining the two schedule windows (court rental 10AM–5PM + open play 5PM–9PM = 10AM–9PM daily); mall hours for Fri–Sun are 10AM–10PM but pickleball close is stated as 9PM."
ph-filinvest-east-homes-pickleball-courts-cainta,session_per_player,Open play (lower tier),120,PHP,,mon|wed|fri|sat,,,,,,medium,Two-tier pricing ₱120/₱200 per player; tier audience not specified on source (likely resident vs guest),"Filinvest East Homes Pickleball Courts ... MWFSa, 6:30a-8:30a; 4p-9p p120/200",PPF PDF lists two prices (₱120/₱200) without explicit member/guest labels. Encoded as two session_per_player tiers with audience blank; legacy hint suggests resident vs guest. Hours shown as two windows on MWF/Sat — represented with open/close spanning both windows and the split noted.
ph-filinvest-east-homes-pickleball-courts-cainta,session_per_player,Open play (higher tier),200,PHP,,mon|wed|fri|sat,,,,,,medium,Two-tier pricing ₱120/₱200 per player; tier audience not specified on source (likely resident vs guest),"Filinvest East Homes Pickleball Courts ... MWFSa, 6:30a-8:30a; 4p-9p p120/200",PPF PDF lists two prices (₱120/₱200) without explicit member/guest labels. Encoded as two session_per_player tiers with audience blank; legacy hint suggests resident vs guest. Hours shown as two windows on MWF/Sat — represented with open/close spanning both windows and the split noted.
ph-five-s-pickleball-general-mamerto-natividad,free,Community play (free),0,PHP,,,,,,,,high,3x weekly schedule; call to coordinate. Contact: Librado Santos 0917-681-7001,"Five-S Pickleball General Mamerto Natividad Nueva Ecija 3 Covered Courts 3x weekly, Call for schedule Free Librado 0917-681-7001 libradosantos817@gmail.com","Price and free-play status are clearly stated in the Philippine Pickleball Federation PDF. Specific days and times are not published — only ""3x weekly, Call for schedule"" is given; hours cannot be resolved without contacting the venue directly."
ph-jcas-malolos-malolos,court_hour,1 Hour Pickleball Court Rental (online),320,PHP,walk_in,,,,60,,,medium,Online booking rate is inclusive of ₱20.00 online processor fee; base court rate is effectively ₱300/hr,1 Hour PICKLEBALL Court Rental ... Online Booking rate is inclusive of Php20.00 online processor fee. ... Price: ₱320.00,"Two distinct pricing models are present: court rental at ₱320/hr (online, incl. ₱20 processor fee) from the booking page, and ₱150/player session play on Tue/Thu/Sat 5–9PM from the pickleball.ph PDF. The legacy note's ₱150/player aligns with the PDF. It is unclear whether the ₱300 walk-in/offline court rate also applies, as only the online price (₱320) is explicitly stated on the booking page."
ph-jcas-malolos-malolos,session_per_player,Open Play Session · Per Player,150,PHP,walk_in,tue|thu|sat,17:00,21:00,,,,medium,From pickleball.ph directory listing,"JCAS Malolos City Bulacan NCR 2 Indoor Courts Tue, Thu, Sat, 5p-9p p150 Jennalyn Tumale","Two distinct pricing models are present: court rental at ₱320/hr (online, incl. ₱20 processor fee) from the booking page, and ₱150/player session play on Tue/Thu/Sat 5–9PM from the pickleball.ph PDF. The legacy note's ₱150/player aligns with the PDF. It is unclear whether the ₱300 walk-in/offline court rate also applies, as only the online price (₱320) is explicitly stated on the booking page."
ph-makati-pickleball-club-makati,session_per_player,Open play,200,PHP,,tue|thu,10:00,13:00,,,,high,"Held at 7224 Malugay St., cor Buendia (shared with The Zone Sports Center)","Makati Pickleball Club 7224 Malugay St., cor Buendia Makati NCR 6 Indoor Courts Tue/Thu, 10a-1p p200/player",Pricing and schedule from pickleball.ph PDF (Sep 2025). Pickleheads listing for shared venue (Zone Sports Center) confirms ₱200 open play rate. No separate entrance fee confirmed for Makati Pickleball Club specifically.
ph-mira-nila-clubhouse-pickleball-quezon-city,session_per_player,Saturday Open Play,170,PHP,walk_in,sat,09:00,13:00,240,,34,high,"3 lined courts, max 34 players. Rental paddles available for ₱50 extra. Payment via GCash; slot confirmed only after uploading proof of payment. Payments transferable but non-refundable. 12-hr freeze time applies for cancellations.","Open Play is just ₱170 per player, making it easy to enjoy competitive games, meet fellow enthusiasts, and be part of a growing pickleball community.","All pricing and hours sourced directly from the Reclub club page and the specific event listing (QYDZQU), both consistently showing ₱170/player for Saturday 9AM–1PM sessions. The event page displays ""$170.00"" with a USD symbol, but the club description explicitly uses ₱170 (PHP) — treated as a Reclub display artefact. Legacy flagged range (₱150–200) is not supported by any current source; ₱170 is the only stated rate. No weekday or other-day hours found."
